{
  "bunkerPubkey": "e771af0b05c8e95fcdf6feb3500544d2fb1ccd384788e9f490bb3ee28e8ed66f",
  "relays": [
    "wss://nsite.run",
    "wss://nos.lol",
    "wss://relay.damus.io",
    "wss://relay.nosto.re"
  ],
  "servers": [
    "https://blssm.us",
    "https://cdn.hzrd149.com",
    "https://nsite.run",
    "https://nosto.re"
  ],
  "id": "nsyte",
  "title": "nsyte.run",
  "description": "nsyte, but testing nsyte deploy to named site"
}
