{
  "relays": [
    "wss://relay.damus.io",
    "wss://nos.lol"
  ],
  "servers": [
    "https://cdn.hzrd149.com"
  ],
  "title": "My Event Viewer",
  "description": "A viewer for various Nostr event types",
  "publishAppHandler": true,
  "appHandler": {
    "kinds": [1, 30023, 30311, 1063],
    "name": "My Custom Event Viewer",
    "description": "Displays various Nostr event types including notes, long-form content, and live events"
  },
  "gatewayHostnames": ["nsite.lol"]
}
