{
  "bunkerPubkey": "9c08bc9679ca77197f3e6a28876b77c5cc4b7a9dd268d9a3cffd7f1eab667cfb",
  "fallback": "/index.html",
  "relays": [
    "wss://relay.nsite.lol",
    "wss://nos.lol",
    "wss://relay.primal.net",
    "wss://relay.damus.io"
  ],
  "servers": [
    "https://blssm.us",
    "https://nostr.download",
    "https://cdn.hzrd149.com"
  ],
  "title": "nsyte (testing)",
  "description": "nsyte, but testing nsyte deploy to named site"
}
